{
  "id": "p3-token-issuance-001",
  "part": "agent-iam-3-authentication",
  "clause": "5.3",
  "kind": "positive",
  "description": "Token issuance is accepted when the Agent is active, the Instance belongs to the same namespace, the lease is valid, and the audience matches.",
  "input": {
    "operation": "issue-token",
    "agent": { "agentState": "active", "agentEpoch": 6 },
    "instance": {
      "namespace": "https://id.example.com/org/acme",
      "agentId": "agt_01JABCDEF0000000000000000",
      "instanceState": "active",
      "lease_expired": false
    },
    "credential": { "active": true, "generation": 2 },
    "requestedAudience": "https://api.example.com/tool/invoke",
    "registeredAudience": "https://api.example.com/tool/invoke"
  },
  "expected": { "outcome": "accept" }
}
