{
  "id": "p3-enrollment-success-001",
  "part": "agent-iam-3-authentication",
  "clause": "4",
  "kind": "positive",
  "description": "A valid, unconsumed challenge with verified workload evidence and a bound proof is accepted.",
  "input": {
    "operation": "enroll",
    "challengeId": "chl_02",
    "challengeConsumed": false,
    "workloadEvidence": { "type": "spiffe", "svidVerified": true, "trustDomain": "example.org" },
    "selectorMatch": true,
    "proof": {
      "iss": "agt_01JABCDEF0000000000000000",
      "sub": "agt_01JABCDEF0000000000000000",
      "aud": "https://id.example.com/org/acme/sts",
      "iat": 1900000000,
      "exp": 1900000300,
      "jti": "jti_02",
      "challengeId": "chl_02",
      "nonce": "n_02"
    }
  },
  "expected": { "outcome": "accept" }
}
