{
  "id": "p7-claim-completeness-002",
  "part": "agent-iam-7-conformance",
  "clause": "5",
  "kind": "positive",
  "description": "A Federated composite-profile claim that lists Parts 2-5 and the required metadata is accepted.",
  "input": {
    "operation": "validate-claim",
    "claim": {
      "compositeProfile": "Federated",
      "supportedParts": [2, 3, 4, 5],
      "proofProfiles": ["spiffe", "dpop"],
      "tokenVersions": ["0.3.0-draft"],
      "revocationSlo": "PT5M",
      "discoveryMechanism": "well-known",
      "knownExtensions": [],
      "unmetClauses": []
    }
  },
  "expected": { "outcome": "accept" }
}
