{
  "id": "p2-agent-id-uniqueness-002",
  "part": "agent-iam-2-registration-discovery",
  "clause": "5.1",
  "kind": "positive",
  "description": "Registering one Agent with a unique namespace and agentId is accepted.",
  "input": {
    "operation": "register",
    "records": [
      {
        "namespace": "https://id.example.com/org/acme",
        "agentId": "agt_01JABCDEF0000000000000000",
        "agentClass": "service",
        "authorityBindingRef": "ab_01",
        "agentState": "registered",
        "agentEpoch": 0
      }
    ]
  },
  "expected": { "outcome": "accept" }
}
