{
  "id": "p2-discovery-success-001",
  "part": "agent-iam-2-registration-discovery",
  "clause": "8",
  "kind": "positive",
  "description": "A registered canonical namespace resolves to a trusted discovery document over HTTPS.",
  "input": {
    "operation": "discover",
    "namespace": "https://id.example.com/org/acme",
    "document": {
      "discoveryVersion": "0.4.1-draft",
      "namespace": "https://id.example.com/org/acme",
      "issuer": "https://id.example.com/org/acme",
      "jwksUri": "https://id.example.com/org/acme/jwks",
      "supportedProofProfiles": ["spiffe", "mtls"]
    },
    "issuerRegistered": true,
    "cacheAgeSeconds": 30,
    "cacheMaxAgeSeconds": 3600
  },
  "expected": { "outcome": "accept" }
}
