{
  "id": "p5-active-trust-001",
  "part": "agent-iam-5-federation",
  "clause": "5",
  "kind": "positive",
  "description": "A brokered token with an active trust, known key, exact audience, valid PoP, and allowed claim mapping is accepted.",
  "input": {
    "operation": "verify-brokered-token",
    "federationTrust": {
      "namespace": "https://id.example.com/org/acme",
      "peerIssuer": "https://id.globex.example/org/globex",
      "allowedAudiences": ["https://api.example.com/partners"],
      "trustStatus": "active"
    },
    "token": {
      "typ": "brokered+jwt",
      "iss": "https://id.globex.example/org/globex",
      "sub": "agt_globex_01",
      "aud": "https://api.example.com/partners",
      "kidKnown": true,
      "signatureValid": true,
      "timeValid": true,
      "popValid": true,
      "claimMapping_valid": true
    }
  },
  "expected": { "outcome": "accept" }
}
