{
  "id": "p2-lifecycle-transition-001",
  "part": "agent-iam-2-registration-discovery",
  "clause": "6.2",
  "kind": "positive",
  "description": "A legal transition that strictly increases agentEpoch is accepted.",
  "input": {
    "operation": "transition",
    "agent": {
      "namespace": "https://id.example.com/org/acme",
      "agentId": "agt_01JABCDEF0000000000000000",
      "agentState": "registered",
      "agentEpoch": 0
    },
    "targetState": "enrolled",
    "targetEpoch": 1
  },
  "expected": { "outcome": "accept" }
}
