{
  "id": "p4-delegation-non-amplification-002",
  "part": "agent-iam-4-authorization",
  "clause": "5.1",
  "kind": "positive",
  "description": "A child grant whose scope and audience are subsets of the parent is accepted.",
  "input": {
    "operation": "attenuate",
    "parent": { "scope": ["read:orders", "write:orders"], "audience": "https://api.example.com", "expiresAt": 2000000000 },
    "child": { "scope": ["read:orders"], "audience": "https://api.example.com", "expiresAt": 1999999000 }
  },
  "expected": { "outcome": "accept" }
}
